{
  "authority_boundary": {
    "archive_authenticity_authorized_in_this_packet": false,
    "archive_integrity_authorized_in_this_packet": false,
    "archive_integrity_issued_in_this_packet": false,
    "authority_transfer_authorized": false,
    "code_rewrite_authorized": false,
    "consensus_rewrite_authorized": false,
    "live_action_executed_in_this_packet": false,
    "live_cobalt_amendment_submission_authorized": false,
    "live_model_request_authorized": false,
    "live_validator_registry_mutation_authorized": false,
    "mainnet_mutation_authorized": false,
    "model_output_generated_in_this_packet": false,
    "protocol_migration_authorized": false,
    "provider_spend_authorized": false,
    "release_effect_post_execution_receipt_accepted_in_this_packet": false,
    "release_effect_post_execution_release_record_archive_integrity_gate_recorded": true,
    "rippled_code_import_authorized": false,
    "rollback_executed_in_this_packet": false,
    "xrpl_compatibility_activation_authorized": false
  },
  "challenge_and_rollback_route": {
    "challenge_packet_required_if_archive_object_roots_missing": true,
    "challenge_packet_required_if_distinct_storage_domains_missing": true,
    "challenge_packet_required_if_expected_post_action_root_mismatch": true,
    "challenge_packet_required_if_integrity_manifest_hashes_mismatch": true,
    "challenge_packet_required_if_integrity_manifest_missing": true,
    "challenge_packet_required_if_integrity_probe_plan_missing": true,
    "challenge_packet_required_if_minimum_distinct_replicas_missing": true,
    "challenge_packet_required_if_redundancy_missing": true,
    "challenge_packet_required_if_retrieval_probe_plan_missing": true,
    "challenge_schema_sha3_384": "c6c53bb8e5b85b332cd72c96c98c44ec3d51ec9050df6ea54ebc84991ce856bb4cd754d2a6945818d72b56d9775002e0",
    "integrity_failure_action": "hold_before_archive_authenticity",
    "live_effect": false,
    "rollback_command_hash": "d5ecd60166e57d39cfd5a24e408b9645b887c7347958b1d0023f58cec39628fd4482e5332a806a754a6efb9aa51d3de3",
    "rollback_receipt_required_if_rollback_required": true,
    "rollback_registry_root": "c794a9ccab78a48ea302b5ce07f03c55e284881622b0b51919e9470ac886303672d8dc65957b34367433b8e6cfea6673",
    "stale_root_policy": "fail_closed_require_regenerated_release_effect_post_execution_release_record_archive_integrity"
  },
  "checks": {
    "authority_transfer": false,
    "challenge_and_rollback_route_verified": true,
    "closed_authority_boundary_verified": true,
    "current_integrity_state_verified": true,
    "integrity_contract_verified": true,
    "integrity_input_requirements_verified": true,
    "no_archive_authenticity_authorized": true,
    "no_archive_integrity_authorized": true,
    "no_archive_integrity_issued": true,
    "no_compatibility_activation": true,
    "no_hidden_evidence": true,
    "no_live_action_execution": true,
    "no_live_cobalt_amendment_submission": true,
    "no_mainnet_mutation": true,
    "no_registry_mutation": true,
    "no_release_effect_post_execution_receipt_accepted": true,
    "no_secret_dependency": true,
    "release_effect_post_execution_release_record_archive_integrity_root_verified": true,
    "root_bindings_verified": true,
    "schema_valid": true,
    "source_release_effect_post_execution_release_record_archive_redundancy_gate_verified": true,
    "stale_root_policy_verified": true,
    "verification_command_coverage_verified": true
  },
  "created_at": "2026-05-25T00:00:00Z",
  "current_integrity_state": {
    "accepted_for_release_or_cobalt_archive_authenticity": false,
    "archive_integrity_archive_object_roots_hash": null,
    "archive_integrity_authorized": false,
    "archive_integrity_distinct_storage_domains": null,
    "archive_integrity_manifest_archive_bundle_hash": null,
    "archive_integrity_manifest_archive_manifest_hash": null,
    "archive_integrity_manifest_durability_root": null,
    "archive_integrity_manifest_hash": null,
    "archive_integrity_manifest_redundancy_root": null,
    "archive_integrity_manifest_release_record_root": null,
    "archive_integrity_manifest_retention_root": null,
    "archive_integrity_manifest_retrieval_probe_plan_hash": null,
    "archive_integrity_minimum_distinct_replicas": null,
    "archive_integrity_probe_plan_hash": null,
    "execution_exit_code": null,
    "execution_stderr_sha3_384": null,
    "execution_stdout_sha3_384": null,
    "live_effect": false,
    "release_effect_post_execution_receipt_hash": null,
    "release_effect_post_execution_release_record_archive_durability_hash": null,
    "release_effect_post_execution_release_record_archive_integrity_hash": null,
    "release_effect_post_execution_release_record_archive_integrity_present": false,
    "release_effect_post_execution_release_record_archive_redundancy_hash": null
  },
  "gate_scope": "protocol_architecture",
  "integrity_contract": {
    "archive_durability_manifest_hash_required": true,
    "archive_durability_manifest_must_bind_retrieval_probe_plan": true,
    "archive_integrity_manifest_hash_required": true,
    "archive_integrity_manifest_must_bind_archive_bundle_hash": true,
    "archive_integrity_manifest_must_bind_archive_manifest_hash": true,
    "archive_integrity_manifest_must_bind_archive_object_roots": true,
    "archive_integrity_manifest_must_bind_distinct_storage_domains": true,
    "archive_integrity_manifest_must_bind_durability_root": true,
    "archive_integrity_manifest_must_bind_integrity_probe_plan": true,
    "archive_integrity_manifest_must_bind_minimum_distinct_replicas": true,
    "archive_integrity_manifest_must_bind_redundancy_root": true,
    "archive_integrity_manifest_must_bind_release_record_root": true,
    "archive_integrity_manifest_must_bind_retention_root": true,
    "archive_integrity_manifest_must_bind_retrieval_probe_plan": true,
    "archive_integrity_not_authorized_in_this_packet": true,
    "archive_integrity_not_recorded_in_this_packet": true,
    "archive_redundancy_manifest_hash_required": true,
    "archive_redundancy_manifest_must_bind_distinct_storage_domains": true,
    "archive_redundancy_manifest_must_bind_minimum_distinct_replicas": true,
    "live_effect": false,
    "next_archive_authenticity_id_required": "vc-protocol-architecture-001-live-effect-release-effect-post-execution-release-record-archive-authenticity-001",
    "observed_post_action_registry_or_release_root_must_equal_expected": true,
    "release_effect_post_execution_release_record_archive_availability_root_required": true,
    "release_effect_post_execution_release_record_archive_durability_id_required": "vc-protocol-architecture-001-live-effect-release-effect-post-execution-release-record-archive-durability-001",
    "release_effect_post_execution_release_record_archive_durability_root_required": true,
    "release_effect_post_execution_release_record_archive_redundancy_id_required": "vc-protocol-architecture-001-live-effect-release-effect-post-execution-release-record-archive-redundancy-001",
    "release_effect_post_execution_release_record_archive_redundancy_root_required": true,
    "release_effect_post_execution_release_record_archive_retention_root_required": true,
    "release_effect_post_execution_release_record_archive_root_required": true,
    "release_effect_post_execution_release_record_root_required": true,
    "release_record_archive_hash_required": true,
    "release_record_archive_manifest_hash_required": true
  },
  "integrity_input_requirements": {
    "live_effect": false,
    "operator_must_confirm_archive_availability_root": "74fbb7d001f966fdd53a02c01069ecfc468d552b436c68dde58d4308989f93e8c71c52b5c469f0b2bb6b6432f1d74df9",
    "operator_must_confirm_archive_durability_root": "0131e65385c1bdb46cf926bbe4c0dba86815d7199bd6fd3ddbfe7e0e6f1040639ee423db240df8b5744064c8b17c1676",
    "operator_must_confirm_archive_manifest_hash": true,
    "operator_must_confirm_archive_object_roots": true,
    "operator_must_confirm_archive_redundancy_root": "cb9fc7e3eb19167a36398e4d662b8e21c11ea6f040e640ef6ef9811ccadd8cf34eed1de90c2c0ee94abed2077d232364",
    "operator_must_confirm_archive_retention_root": "4d2c1a4d05dfa019b929fde6bc18e7af88fec5bc283a95ee72ff266a3d67c69536a36bdbf988cb13c8191fd0996743c9",
    "operator_must_confirm_archive_root": "c53539105ce6f9ac32b1bc0120919bc20ac5939d924d862d21018c5128d55f8fb59cab7c7ebff3b035bfc0f632a71e37",
    "operator_must_confirm_distinct_storage_domains": true,
    "operator_must_confirm_durability_manifest_binds_retrieval_probe_plan": true,
    "operator_must_confirm_durability_manifest_hash": true,
    "operator_must_confirm_expected_post_action_root": "2a30649283caeb4e444fc6ead3f942190d5a130c2f7e71afb2c8de911b2f16b50b2b36757b31b29efc3fd67a463c0c10",
    "operator_must_confirm_integrity_manifest_binds_archive_bundle_hash": true,
    "operator_must_confirm_integrity_manifest_binds_archive_manifest_hash": true,
    "operator_must_confirm_integrity_manifest_binds_durability_root": true,
    "operator_must_confirm_integrity_manifest_binds_redundancy_root": true,
    "operator_must_confirm_integrity_manifest_binds_release_record_root": true,
    "operator_must_confirm_integrity_manifest_binds_retention_root": true,
    "operator_must_confirm_integrity_manifest_binds_retrieval_probe_plan": true,
    "operator_must_confirm_integrity_manifest_hash": true,
    "operator_must_confirm_integrity_probe_plan": true,
    "operator_must_confirm_minimum_distinct_replicas": true,
    "operator_must_confirm_no_stale_roots": true,
    "operator_must_confirm_redundancy_manifest_binds_distinct_storage_domains": true,
    "operator_must_confirm_redundancy_manifest_binds_minimum_distinct_replicas": true,
    "operator_must_confirm_redundancy_manifest_hash": true,
    "operator_must_confirm_release_record_manifest_hash": true,
    "operator_visible_post_execution_release_record_archive_integrity_hashes": {